name,province,city,address,phone_number,website
کتابخانه مدرسه علمیه خواهران زینبیه (س) فارسان,چهار محال و بختیاری,فارسان,فارسان- میدان دفاع مقدس- بلوار آیت الله خامنه ای- حد فاصل بیمارستان و پاسگاه,03833227343 ( داخلی  ),http://
کتابخانه مدرسه علمیه خواهران زینبیه (س) کرج,البرز,كرج,كرج- خیابان كمربندی- چهارراه مصباح- خیابان شهید نجاری,02632706128 ( داخلی  ),http://
كتابخانه مدرسه علمیه خواهران شهید مطهری,مازندران,تنكابن,تنكابن - پایین مصلی - خیابان ورزش -مقابل اداره تربیت بدنی.,54230561-011 ( داخلی  ),http://lib.whc.ir
کتابخانه مدرسه علمیه خواهران شهیده بنت الهدی صدر علی آباد کتول,گلستان,علی آباد كتول,علی آبادکتول- خیابان خضر- كوی مطهر,01734222835 ( داخلی  ),http://
كتابخانه مدرسه علمیه خواهران صدیقه فاطمه (س),گلستان,گرگان,گركان - خیابان امام خمینی (ره) - كوچه آفتاب 15 - فرعی اول سمت چپ - پشت مدرسه علمیه امام صادق (ع).,32234339-017 ( داخلی  ),http://lib.whc.ir
کتابخانه مدرسه علمیه خواهران صدیقه کبری (س) بهار,همدان,بهار,بهار- میدان امام خمینی(ره)- فلكه حر- انتهای خیابان فداییان اسلام,08134503740 ( داخلی  ),http://
کتابخانه مدرسه علمیه خواهران صدیقه کبری (س) گلپایگان,اصفهان,گلپایگان,گلپایگان- بعد از میدان معلم- جنب پمپCNG,03157471044 ( داخلی  ),http://
کتابخانه مدرسه علمیه خواهران عصمتیه سمنان,سمنان,سمنان,سمنان- شهرك مدیران- بالاتر از میدان پدران آسمانی- تقاطع چهار فصل,02333433412 ( داخلی  ),http://
کتابخانه مدرسه علمیه خواهران فاطمة الزهرا (س) اراک,مرکزی,اراک,اراك- شهر صنعتی- میدان بنفشه- کانون امام جعفر صادق(ع),08633123554 ( داخلی  ),http://
کتابخانه مدرسه علمیه خواهران فاطمة الزهرا (س) اهر,آذربایجان شرقی,اهر,اهر- میدان دفاع مقدس- روبروی كلانتری- طبقه دوم ساختمان سابق هلال احمر,04144240105 ( داخلی  ),http://
كتابخانه مدرسه علمیه خواهران فاطمة الزهراء (س),یزد,اردكان,اردكان - بلوار شهید بهشتی - نرسیده به میدان چادرملو - پشت قنادی قدیر.,23229748-035 ( داخلی  ),http://lib.whc.ir
كتابخانه مدرسه علمیه خواهران فاطمة الزهراء (س),مازندران,تنكابن,تنكابن - جنب امامزاده سید حسین (ع) - خیابان شهید بزرگی - كوچه امامزاده قاسم.,54375406-011 ( داخلی  ),http://lib.whc.ir
كتابخانه مدرسه علمیه خواهران فاطمة الزهراء (س),اصفهان,خميني شهر,خمینی شهر - میدان آزادی - خیابان آیت الله جبل عاملی - كوچه گلشن - شماره 24 .,33640250-031 ( داخلی  ),http://lib.whc.ir
كتابخانه مدرسه علمیه خواهران فاطمة الزهراء (س),فارس,داراب,داراب - بلورا جمهوری اسلامی - جنب امور عشایری.,53564460-071 ( داخلی  ),http://lib.whc.ir
كتابخانه مدرسه علمیه خواهران فاطمة الزهراء (س),فارس,شیراز,شیراز - بلوار مدرس - بلوار فضیلت جنوبی - نرسیده به چهار را فضیلت - سمت راست - خیابان فیض.,2-37337440-071 ( داخلی  ),http://lib.whc.ir
كتابخانه مدرسه علمیه خواهران فاطمه الزهراء (س),البرز,كرج,کرج - فاز ۴ مهرشهر - بلوارگلها - خیابان ۴۰۵ شرقی - مدرسه علمیه فاطمه الزهرا(س).,33554101-026 ( داخلی  ),http://
کتابخانه مدرسه علمیه خواهران فاطمة الزهراء (س) اسلام آباد غرب,کرمانشاه,اسلام آباد غرب,اسلام آباد غرب- میدان شهید بهشتی- بلوار یادگار امام- روبروی CNG,08345244645 ( داخلی  ),http://
کتابخانه مدرسه علمیه خواهران فاطمة الزهراء (س) آمل,مازندران,آمل,آمل- دریایی16- خیابان شهید اسدی- ساختمان شهید اسدی,01144224434 ( داخلی  ),http://
کتابخانه مدرسه علمیه خواهران فاطمة الزهراء (س) بم,کرمان,بم,بم- میدان امام خمینی ره- خیابان امام خمینی(ره)- کوچه شماره 12,03434220843 ( داخلی  ),http://
کتابخانه مدرسه علمیه خواهران فاطمة الزهراء (س) بندر ترکمن,گلستان,بندر ترکمن,بندرتركمن- خیابان آزادی- خیابان شهیدنیازی- جنب مخابرات جدید,01734422235 ( داخلی  ),http://
کتابخانه مدرسه علمیه خواهران فاطمة الزهراء (س) بیجار,کردستان,بیجار,بیجار- بلوار امام- بلوار شهید رجائی- نبش کوچه کوثر,08738232030 ( داخلی  ),http://
کتابخانه مدرسه علمیه خواهران فاطمة الزهراء (س) تهران,تهران,تهران,تهران- بزرگراه اشرفی اصفهانی- پائین تر از میدان پونك- كوچه گلزار یكم- پلاك34,02144452510 ( داخلی  ),http://
کتابخانه مدرسه علمیه خواهران فاطمة الزهراء (س) ساوه,مرکزی,ساوه,,( داخلی  ),http://
کتابخانه مدرسه علمیه خواهران فاطمة الزهراء (س) گله دار,فارس,گله دار,گله دار- بخش گله دار- جنب بانك انصارالمجاهدین,07152854405 ( داخلی  ),http://
کتابخانه مدرسه علمیه خواهران فاطمه الزهراء (س) مرند,آذربایجان شرقی,مرند,مرند- شهرك میلاد- مدرسه علمیه فاطمه الزهرا(س),04142284044 ( داخلی  ),http://
کتابخانه مدرسه علمیه خواهران فاطمه بنت اسد (س) بسطام,سمنان,بسطام,بسطام- انتهای خیابان مهدیه- نرسیده به پمپ بنزین,02332525138 ( داخلی  ),http://
کتابخانه مدرسه علمیه خواهران فاطمه (س) سقز,کردستان,سقز,سقز- شهرك دانشگاه- خیابان شهید مظهر- روبه روی خانه سالمندان مهر,08736224508 ( داخلی  ),http://
كتابخانه مدرسه علمیه خواهران فاطمیه (س),تهران,پاكدشت,پاكدشت - خیابان شهید مطهری - جنب دانشگاه ابوریحان - بلوار شهدای گمنام - مصلای امام خمینی (ره).,33022670-021 ( داخلی  ),http://lib.whc.ir
كتابخانه مدرسه علمیه خواهران فاطمیه (س),اصفهان,اندان,خمینی شهر-خمینی شهر- میدان شهدا- خ مدرس- ک مدرسه علمیه فاطمیه- حوزه علمیه فاطمیه س.,33677295-031 ( داخلی  ),http://
كتابخانه مدرسه علمیه خواهران فاطمیه (س),البرز,كرج,كرج - میدان امام(ره) - خیابان چالوس - مسجد جامع - مدرسه علمیه فاطمیه(س).,32230492-026 ( داخلی  ),http://whc.net
كتابخانه مدرسه علمیه خواهران فاطمیه (س),کرمان,كرمان,كرمان - میدان شهدا(مشتاق)- جنب مسجد جامع- حوزه علمیه فاطمیه (س).,32267932-034 ( داخلی  ),http://blog114.womenhc.com
کتابخانه مدرسه علمیه خواهران فاطمیه (س) پیشوا,تهران,پیشوا,پیشوا- خیابان امام- خیابان كارگر- روبروی تربیت معلم,021367269559 ( داخلی  ),http://
کتابخانه مدرسه علمیه خواهران فاطمیه (س) تهران,تهران,تهران,تهران- پاسداران- بوستان نهم- پلاك129- روبروی درمانگاه لبافی نژاد,02122598047 ( داخلی  ),http://
کتابخانه مدرسه علمیه خواهران فاطمیه (س) خمینی شهر,اصفهان,خميني شهر,خمینی شهر- میدان شهدا- خیابان مدرس- كوچه فاطمیه,03133677295 ( داخلی  ),http://
کتابخانه مدرسه علمیه خواهران فاطمیه (س) دامغان,سمنان,دامغان,دامغان- كمربندی سابق- شهرك بوستان- خیابان سنایی- جنب آموزشگاه ارمغان تربیت,02335263811 ( داخلی  ),http://
کتابخانه مدرسه علمیه خواهران فاطمیه (س) شهرکرد,چهار محال و بختیاری,شهر كرد,شهركرد- میدان انقلاب- بلوار17شهریور- نبش كوچه35- پلاك2,03833335750 ( داخلی  ),http://
کتابخانه مدرسه علمیه خواهران فاطمیه (س) شیراز,فارس,شیراز,شیراز- خیابان قصر الدشت- كوچه63- کنار امامزاده شاه قیس- حوزه فاطمیه (س),07136291725 ( داخلی  ),http://
کتابخانه مدرسه علمیه خواهران فاطمیه (س) صومعه سرا,گیلان,صومعه سرا,صومعه سرا- خیاباى آیت الله طالقانی- روبروی فلکه عربان,01344323350 ( داخلی  ),http://
کتابخانه مدرسه علمیه خواهران فاطمیه (س) نجف آباد,اصفهان,نجف آباد,نجف آباد- خیابان امام (ضلع غربی)- جنب مسجد جامع- بن بست حجاب(مركز شهر),03142639229 ( داخلی  ),http://
کتابخانه مدرسه علمیه خواهران فاطمیه (س) نقده,آذربایجان غربی,نقده,نقده- زمین های 53 هکتاری- خیابان مرصاد- جنب مسجد نبی اکرم (ص),0445677771 ( داخلی  ),http://
کتابخانه مدرسه علمیه خواهران فاطمیه (س) هادیشهر,آذربایجان شرقی,هادي شهر,جلفا- ابتدای بلوار رسالت- خیابان شهید تیمسار فلاحی,04142014740 ( داخلی  ),http://
كتابخانه مدرسه علمیه خواهران محدثه (س),لرستان,بروجرد,بروجرد - خیابان شریعتی - كوچه ناصر خسرو (شهید محمد حسین عسگرپور) پلاك 14.,42446902-066 ( داخلی  ),http://lib.whc.ir
كتابخانه مدرسه علمیه خواهران مشكات اندیشه,تهران,تهران,تهران - خیابان خاوران - بعد از میدان ثامن الحجج(ع) - سمت راست - خیابان جنب مسجد سید الشهدا(ع)(8 متری سید الشهدا(ع).,33862500-021 ( داخلی  ),http://lib.whc.ir
کتابخانه مدرسه علمیه خواهران معصومیه (س) نهاوند,همدان,نهاوند,نهاوند- میدان امام-  انتهای مصلی,08133223367 ( داخلی  ),http://
کتابخانه مدرسه علمیه خواهران معصومیه فهرج,کرمان,فهرج,,( داخلی  ),http://
کتابخانه مدرسه علمیه خواهران نرجسیه (س) سنقر,کرمانشاه,سنقر,سنقر- ضلع غربی- میدان امام خمینی(ره),08348421044 ( داخلی  ),http://
کتابخانه مدرسه علمیه خواهران کریمه اهلبیت (س) خوانسار,اصفهان,خوانسار,خوانسار- بلوار معلم- پشت اداره اوقاف و امور خیریه- كوچه گلشن,03157233771 ( داخلی  ),http://
كتابخانه مدرسه علمیه خواهران كوثر,اصفهان,كاشان,خيابان امام خمينى، جنب گلابچى، مدرسه علميه كوثر (س).,34442357-031 ( داخلی  ),http://kosar-kashan.womenhc.com
كتابخانه مدرسه علمیه خواهران كوثر,همدان,تویسرکان,تویسركان - میدان دفاع مقدس - جنب دفتر امام جمعه – روبروی پارك نبوت - مدرسه علمیه كوثر.,34923101-081 ( داخلی  ),http://kosar-toysarkan.womenhc.com
کتابخانه مدرسه علمیه خواهران کوثر (س) اصفهان,اصفهان,اصفهان,اصفهان- خیابان آیت الله كاشانی- روبروی امامزاده سید موسی - جنب خیابان میرداماد- بن بست مهر,10105029052 ( داخلی  ),http://
کتابخانه مدرسه علمیه خواهران کوثر (س) خرمشهر,خوزستان,خرمشهر,خرمشهر- كوی شاه عباس-  روبروی دانشگاه آزاد- مسجد آیت الله خامنه ای,06153543431 ( داخلی  ),http://
کتابخانه مدرسه علمیه خواهران کوثر (س) زاویه,مرکزی,زاویه,زاویه- خیابان آسیا بك- خیابان بسیج- کوی شهید محمد رستگاری,08645228088 ( داخلی  ),http://
كتابخانه مدرسه علمیه خواهران كوثریه,تهران,تهران,تهران - خیابان وحدت اسلامی - پائین تر از بیمارستان رازی - كوچه سید حسن خندان - انتهای كوچه مسجد علی بن ابیطالب (ع).,55603134-021 ( داخلی  ),http://lib.whc.ir
كتابخانه مدرسه علمیه شهید آیت الله صدوقی,خراسان رضوی,مشهد,مشهد مقدس - میدان شهدا – خیابان آیت الله عبادی – بین عبادی 6 و 8 – مدرسه علمیه آیت الله شهید صدوقی,37251196-051 ( داخلی  ),http://
کتابخانه مدرسه علمیه عالی نواب,خراسان رضوی,مشهد,خراسان رضوی - مشهد - حرم مطهر، اول خیابان شیرازی مدرسه علمیه عالی نواب,05132259559 ( داخلی 229 ),http://h-navvab.ir
کتابخانه مدرسه علمیه عصمتیه بابل,مازندران,بابل,بابل- خیابان امام خمینی(ره)- چهارسوق- پشت مسجد كاظم بیك- محله باقرناظر- فاضل استرآبادی6- مقابل تكیه,01132295097 ( داخلی  ),http://
کتابخانه مدرسه علمیه فاطمة الزهراء (س) سلماس,آذربایجان غربی,سلماس,سلماس- خیابان شهید چمران- پشت اداره دادگستری- جنب آپارتمان های سپهر,04435247565 ( داخلی  ),http://
کتابخانه مدرسه علمیه فاطمة الزهراء (س) نجف آباد (ویلاشهر),اصفهان,نجف آباد,ویلاشهر- خیابان بهاران- خیابان 119- پلاك3,03142251800 ( داخلی  ),http://
کتابخانه مدرسه علمیه فاطمیه (س) الیگودرز,لرستان,اليگودرز,الیگودرز- شهرك الغدیر- روبروی ترمینال شهرستان,06643331460 ( داخلی  ),http://
کتابخانه مدرسه علمیه فاطمیه (س) بردسیر,کرمان,بردسیر,بردسیر- خیابان امام- کوچه برق- فرعی9,03433525030 ( داخلی  ),http://
کتابخانه مدرسه علمیه فاطمیه (س) رودسر,گیلان,رودسر,رودسر- شهرک شهید انصاری- خیابان برقزان- جنب مسجد امام خمینی (ره),01342629007 ( داخلی  ),http://
كتابخانه مدرسه علمیه نرجس,خراسان رضوی,مشهد,مشهد مقدس - انتهاي خيابان دانش غربي - مدرسه علميه نرجس.,38544677-38595040-051 ( داخلی  ),http://m-narjes.com
كتابخانه مدرسه فرزانگان قم,قم,قم,قم - شهرك امام خمینی (ره) - خیابان شهید مطهری.,32700246-025 ( داخلی  ),http://farzaneganqom.ir
كتابخانه مدرسه فقهی امام باقر (ع),قم,قم,قم - خیابان شهدا - انتهای كوچه 19 - سمت راست - مدرسه فقهی امام محمد باقر علیه السلام.,37741514-025 ( داخلی  ),http://mfeb.ir
کتابخانه مدیریت بحران (کتابخانه های سازمان فرهنگی هنری شهرداری تهران),تهران,تهران,تهران - انتهای بزرگراه جلال آل احمد- نرسیده به بزرگراه آیت اله اشرفی اصفهانی- نبش خیابان نهم شمالی- سازمان پیشگیری و مدیریت بحران شهر تهران.,44244040-021 ( داخلی  ),http://tlib.ir
كتابخانه مرتضوى (آستان قدس رضوی ع),کرمان,رفسنجان,رفسنجان - بلوار آیت الله طالقاني - چهارراه اميركبير.,34259751-034 ( داخلی  ),http://aqlibrary.org/libraries/lib30.aspx
كتابخانه مروج (آستان قدس رضوی ع),یزد,يزد,يزد - خيابان شهيد چمران - كتابخانه مروج.,36231112-035 ( داخلی  ),http://aqlibrary.org/libraries/lib29.aspx
کتابخانه، مرکز اسناد و مدارک علمی پژوهشگاه حوزه و دانشگاه,قم,قم,دفتر قم مقدسه - شهرك پرديسان - بلوار دانشگاه - جنب دانشگاه آزاد اسلامى. دفتر تهران - خيابان انقلاب اسلامی - نرسيده به وصال شيرازی - كوچه اسكو - پلاك4 .,02532111301 ( داخلی  ),http://www.lib.rihu.ac.ir
كتابخانه مركز اسناد و مركز دائرة المعارف بزرگ اسلامى,تهران,تهران,تهران - خيابان نياوران- كاشانك نرسيده به خيابان آجودانيه.,22297626-021 ( داخلی  ),http://cgie.org.ir
كتابخانه مركز آموزش عالی ثامن الحجج (ع),خراسان رضوی,مشهد,مشهد مقدس- بلوار دانشجو - نبش دانشجوی 33 - مركز آموزش عالی ثامن الحجج (ع),38924330-051 ( داخلی  ),http://samen.te.cfu.ac.ir
كتابخانه مركز آموزش عالی دانشور نيشابور (دانشگاه فرهنگيان),خراسان رضوی,نيشابور,نیشابور- بلوار جمهوری اسلامی – مركز آموزش عالی دانشور.,42226068-42217550-42226209-051 ( داخلی  ),http://tmd.te.cfu.ac.ir
كتابخانه مركز آموزشی، درمانی، روانپزشكی رازی,تهران,تهران,شهرری – امین آباد- مركز آموزشی، درمانی،روانپزشكی رازی.,33401603-021 ( داخلی  ),http://razi.uswr.ac.ir
کتابخانه مرکز بررسی های اسلامی قم,قم,قم,قم مقدسه - شهرک پردیسان - بلوار دانشگاه - بلوار سلمان – خیابان شهید کوچکی زاده – خیابان شهید مخلصی - کتابخانه مرکز بررسی های اسلامی,37741423-025 ( داخلی  ),http://iscq.ir
کتابخانه مرکز بین المللی آموزش زبان فارسی دانشگاه تهران,تهران,تهران,تهران- خیابان ولی عصر- ایستگاه پسیان- موسسه لغتنامه دهخدا و مرکز بین المللی آموزش زبان فارسی- شماره 3011 .,22719495 ( داخلی  ),http://icps.ut.ac.ir/shahidi%20library.html
کتابخانه مرکز پژوهش متالورژی رازی,تهران,تهران,تهران - كیلومتر ۲۱ جاده مخصوص كرج - ورودی شهر قدس - خیابان فرنان - انتهای خیابان - پلاک ۸ - مركز پژوهش متالورژی رازی.,46831570-021 ( داخلی 371 ),http://lib.razi-center.net/simwebclt/WebAccess/SimwebPortal.dll
کتابخانه مركز پژوهش های اسلامی و دانشكده صدا و سيما,قم,قم,قم مقدسه – بلوار امین (ص) – صدا و سیما – مركز پژوهشهای اسلامی صدا و سیما.,32920077-025 ( داخلی  ),http://lib.iriblib.ir
كتابخانه مركز پژوهشی دائرة المعارف علوم عقلی اسلامى,قم,قم,قم مقدسه - شهرك پرديسان - شعبه 2 موسسه آموزشي و پژوهشي امام خميني (ره)- مركز پژوهشي دائرةالمعارف علوم عقلي اسلامى.,02532113739 ( داخلی  ),http://dmaaref.iki.ac.ir
كتابخانه مركز تحقيقات امام علی علیه السلام,تهران,تهران,تهران - خیابان کریمخان - بین خیابان شهید قرنی و ایرانشهر - پلاک 178 .,88317196-021 ( داخلی  ),http://imamali.ac.ir
كتابخانه مركز تحقيقات آموزش و پرورش,قم,قم,قم مقدسه - گلزار شهدا – جنب هنرستان شهيد رجايى- مركز تحقيقات آموزش و پرورش.,37737766-025 ( داخلی  ),http://
کتابخانه مرکز تحقیقات بین المللی بیابان دانشگاه تهران,تهران,تهران,تهران- بلوار کشاورز- خیابان قدس- نبش کوچه شاهد- پلاک37- طبقه چهارم- مرکز تحقیقات بین المللی بیابان.,88971717-88973295 ( داخلی  ),http://desert.ut.ac.ir
کتابخانه مرکز تحقیقات‌ بیوشیمی‌- بیوفیزیک‌ دانشگاه تهران,تهران,تهران,تهران - دانشگاه تهران - ساختمان مركز تحقيقات بيوشيمي - بيوفيزيك.,66491147، 61113375 ( داخلی  ),http://ibb.ut.ac.ir
کتابخانه مرکز تحقیقات رایانه ای حوزه علمیه اصفهان,اصفهان,اصفهان,اصفهان - خیابان شهید مطهری-ابتدای خیابان اردیبهشت جنوبی - مرکز تحقیقات رایانه ای حوزه علمیه اصفهان.,38137-031 ( داخلی 114 ),http://hozeh.org
كتابخانه مرکز تحقیقات و آموزش كشاورزی و منابع طبیعی,قم,قم,قم - بلوار غدیر- جنب بوستان علوی - ساختمام سازمان جهاد کشاورزی - طبقه اول.,32126699-025 ( داخلی  ),http://qom.areo.ir
کتابخانه مرکز علمی کاربردی معماری و شهرسازی شیخ بهایی (کتابخانه های سازمان فرهنگی هنری شهرداری تهران),تهران,تهران,تهران - بزرگراه نواب صفوی- بالاتر از میدان حق شناس- نبش خیابان جوانمرد- ساختمان دماوند۹,55433257-021 ( داخلی  ),http://tlib.ir
كتابخانه مركز ملی جهانی شدن,تهران,تهران,تهران ـ خیابان سعادت آباد ـ خیابان هجدهم غربي ـ پلاك 17 .,22073024-021 ( داخلی  ),http://globalization.ir
کتابخانه مرکزی آستان قدس رضوی,خراسان رضوی,مشهد,حرم مطهر ، بست شیخ طوسی کتابخانه مرکزی,05132210018 ( داخلی 3370 ),http://www.razavi.aqr.ir
كتابخانه مركزی آستان قدس رضوی (ع) - تالار جوانان پسر,خراسان رضوی,مشهد,مشهد مقدس - حرم مطهر امام رضا علیه السلام - بست شيخ طوسی - سازمان كتابخانه ها، موزه ها و مركز اسناد آستان قدس رضوی (ع).,8-32232004-051 ( داخلی  ),http://aqlibrary.org/about/centerlib.aspx
كتابخانه مركزی آستان قدس رضوی (ع) - تالار جوانان دختر,خراسان رضوی,مشهد,مشهد مقدس - حرم مطهر امام رضا علیه السلام - بست شيخ طوسی - سازمان كتابخانه ها، موزه ها و مركز اسناد آستان قدس رضوی (ع).,8-32232004-051 ( داخلی  ),http://aqlibrary.org/about/centerlib.aspx
كتابخانه مركزی آستان قدس رضوی (ع) - تالار قفسه باز آقايان,خراسان رضوی,مشهد,مشهد مقدس - حرم مطهر امام رضا علیه السلام - بست شيخ طوسي - سازمان كتابخانه ها، موزه ها و مركز اسناد آستان قدس رضوي (ع).,8-32232004-051 ( داخلی  ),http://aqlibrary.org/about/centerlib.aspx
كتابخانه مركزی آستان قدس رضوی (ع) - تالار قفسه باز بانوان,خراسان رضوی,مشهد,مشهد مقدس - حرم مطهر امام رضا علیه السلام - بست شيخ طوسي - سازمان كتابخانه ها، موزه ها و مركز اسناد آستان قدس رضوي (ع).,8-32232004-051 ( داخلی  ),http://aqlibrary.org/about/centerlib.aspx
كتابخانه مركزی آستان قدس رضوی (ع) - تالار نوجوان پسر,خراسان رضوی,مشهد,مشهد مقدس - حرم مطهر امام رضا علیه السلام - بست شيخ طوسي - سازمان كتابخانه ها، موزه ها و مركز اسناد آستان قدس رضوى.,8-32232004-051 ( داخلی  ),http://aqlibrary.org/about/centerlib.aspx
كتابخانه مركزی آستان قدس رضوی (ع) - تالار نوجوان دختر,خراسان رضوی,مشهد,مشهد مقدس - حرم مطهر امام رضا علیه السلام - بست شيخ طوسي - سازمان كتابخانه ها، موزه ها و مركز اسناد آستان قدس رضوى (ع).,8-32232004-051 ( داخلی  ),http://aqlibrary.org/about/centerlib.aspx
