name,province,city,address,phone_number,website
كتابخانه عمومی كوثر مرند,آذربایجان شرقی,مرند,مرند -  خيابان امام خميني (ره) - روبروي بانك كشاورزى.,42260144-041 ( داخلی  ),http://.tabrizpl.ir
كتابخانه عمومی يادگار امام (ره),قم,قم,قم مقدسه - بلوار شهید صدوقی - شهرك امام خميني (ره)- جنب مسجد قدس.,32705282-025 ( داخلی  ),http://qompl.ir
كتابخانه عمومی يامچى,آذربایجان شرقی,مرند,مرند –  يامچي - بلوار ولايت - خيابان طالقاني - جنب مدرسه درخشان.,42163020-041 ( داخلی  ),http://tabrizpl.ir
كتابخانه عمومی یزدانشهر,اصفهان,نجف آباد,نجف آباد - یزدانشهر - خیابان 21 شرقی.,32445535-031 ( داخلی  ),http://isfahanpl.ir
كتابخانه عمومی یكانكهریز,آذربایجان شرقی,مرند,روستاي يكان كهريز - خیابان اصلی - روبروي بهداشت.,42166393-041 ( داخلی  ),http://
کتابخانه فجر (کتابخانه های سازمان فرهنگی هنری شهرداری تهران),تهران,تهران,تهران - بلواريافت‌آباد - ابراهيم‌آباد - خيابان اسدآبادی - ‌بوستان مينا.,66817456-021 ( داخلی  ),http://tlib.ir
کتابخانه فردوس (کتابخانه های سازمان فرهنگی هنری شهرداری تهران),تهران,تهران,تهران - فلكه دوم صادقيه- بلوار فردوس- بعد از چهارراه مخابرات- فرهنگسراي فردوس.,44081043-021 ( داخلی  ),http://tlib.ir
کتابخانه فردوسی (کتابخانه های سازمان فرهنگی هنری شهرداری تهران),تهران,تهران,تهران - خيابان شوش - خيابان ری - خيابان انبارگندم - كتابخانه فردوسي.,33562082-021 ( داخلی  ),http://tlib.ir
کتابخانه فرزانگان (کتابخانه های سازمان فرهنگی هنری شهرداری تهران),تهران,تهران,تهران - نارمك - انتهاي خيابان گلستان - جنب بوستان تسليحات - كوچه شهيد غلام رضاگلستاني - شماره ۱۲۸.,77818842-021 ( داخلی  ),http://tlib.ir
کتابخانه فناوری اطلاعات (کتابخانه های سازمان فرهنگی هنری شهرداری تهران),تهران,تهران,تهران - ابتداي خوش جنوبي- خيابان شهيد اميرقلي- نرسيده به تقاطع ناهيد- فرهنگسرای عطار نيشابوري.,66902134-021 ( داخلی  ),http://tlib.ir
کتابخانه قائم (عج) (کتابخانه های سازمان فرهنگی هنری شهرداری تهران),تهران,تهران,تهران - بلواريافت آباد - بعدازميدان معلم - جنب مجتمع قضايي يافت آباد - بوستان قائم(عج).,66217766-021 ( داخلی  ),http://tlib.ir
کتابخانه قیصر امین پور (کتابخانه های سازمان فرهنگی هنری شهرداری تهران),تهران,تهران,تهران - مهرآباد جنوبي - خيابان توكلي - كوچه شهيد ابراهيم اصفهاني - پلاك ۴۶ـ خانه فرهنگ مهرآباد.,66620163-021 ( داخلی  ),http://tlib.ir
کتابخانه گروه باستان شناسی دانشکده ادبیات دانشگاه تهران,تهران,تهران,تهران - خیابان انقلاب اسلامی - دانشگاه تهران.,66913992 ( داخلی 2569 ),http://ut.ac.ir
کتابخانه گروه تاریخ دانشگاه تهران,تهران,تهران,تهران - خیابان انقلاب اسلامی - دانشگاه تهران.,61117252 ( داخلی  ),http://ut.ac.ir
کتابخانه گروه زبان و ادبیات فارسی دانشگاه تهران,تهران,تهران,تهران - خیابان انقلاب اسلامی - دانشگاه تهران.,61113082 ( داخلی  ),http://ut.ac.ir
کتابخانه گلستان (کتابخانه های سازمان فرهنگی هنری شهرداری تهران),تهران,تهران,تهران - نارمك - ميدان هلال احمر - خيابان گلستان - ضلع شمالي بوستان فدك - فرهنگسراي گلستان.,77827730-021 ( داخلی  ),http://tlib.ir
كتابخانه گنجینه نور (مركز حفظ و نگهداری پژوهش ها و پایان نامه های قرآنی) مؤسسه معارف اسلامی امام رضا (ع),قم,قم,قم مقدسه- بلوار شهید محمد منتظری - كوچه شماره 8 - پلاك 12 .,377422010-37740559-025 ( داخلی  ),http://maaref.ir
کتابخانه لویزان (کتابخانه های سازمان فرهنگی هنری شهرداری تهران),تهران,تهران,تهران - لویزان - خیابان جوانشیر- سه راه لویزان-خیابان شعبانلو- روبروی مخابرات شهیدلطیفی-  بوستان سخندان- کتابخانه عمومی لویزان.,22956644-021 ( داخلی  ),http://tlib.ir
کتابخانه مجازی (دیجیتالی) الفبا,تهران,تهران,تهران- خیابان شهید بهشتی- بعد از تقاطع سهروردی- جنب بانک تجارت- پلاک 146- طبقه2,95119260-021 ( داخلی  ),http://alefbalib.com/?pid=29
كتابخانه مجتمع فرهنگی امام خمينی (ره) (آستان قدس رضوی ع),خراسان رضوی,مشهد,خیابان خواجه ربیع 23,37411100-051 ( داخلی 37414621 - 051 ),https://library.razavi.ir/aqlibraries
كتابخانه مجلس شورای اسلامى,تهران,تهران,تهران - ضلع جنوب شرقي ميدان بهارستان - كتابخانه مجلس شوراي اسلامى.,33130911-021 ( داخلی  ),http://ical.ir
كتابخانه مجمع عالی حكمت اسلامی,قم,قم,قم - خیابان 19 دی- كوچه 10- فرعی اول سمت چپ- پلاك 5 .,11-37757610-025 ( داخلی  ),http://hekmateislami.com
كتابخانه مدرسه اسلامی هنر,قم,قم,قم مقدسه - بلوار بسیج (سی متری هنرستان) - بین کوچه 20 و 22.,02537830782 ( داخلی  ),http://Itaihe.ac.ir
كتابخانه مدرسه عالی شهيد مطهری (ره),تهران,تهران,تهران - میدان بهارستان – مدرسه عالی شهید مطهری.,33124472-021 ( داخلی  ),http://motahari.ac.ir/web/guest/library
كتابخانه مدرسه عالی فقه و معارف اسلامی (حجتيه),قم,قم,قم مقدسه- ميدان شهداء - خيابان حجتيه- مدرسه مباركه حجتيه.,37742086-025 ( داخلی  ),http://feqh.miu.ac.ir
کتابخانه مدرسه علمیه الزهراء (س) آباده طشک,فارس,آباده طشک,آباده طشك- خیابان امام حسین(ع)- جنب بنیاد شهید,07153894322 ( داخلی  ),http://
کتابخانه مدرسه علمیه الزهراء (س) مینودشت,گلستان,مینودشت,مینودشت- خیابان دار الولایت- جنب مسكن مهر- پشت بیمارستان تأمین اجتماعی,01735280500 ( داخلی  ),http://
كتابخانه مدرسه علمیه پیروان حضرت زهرا (س),خراسان رضوی,مشهد,مشهد مقدس - خیابان امام رضا علیه السلام- ك 60.,33411210-051 ( داخلی  ),http://peyrovan-zahra.com
کتابخانه مدرسه علمیه خواهران الزهرا (س) شهر بابک,کرمان,شهربابک,شهربابک- خیابان پاسداران-  انتهای بلوار کوثر- کوی پرستار2,03434131865 ( داخلی  ),http://
کتابخانه مدرسه علمیه خواهران الزهراء المرضیه (س) اصفهان,اصفهان,اصفهان,اصفهان- خیابان هاتف- جنب بانك ملی- كوی 9- كوی حیدر میرزا- بن بست جلو خانه- انتهای بن بست,03132241332 ( داخلی  ),http://
كتابخانه مدرسه علمیه خواهران الزهراء (س),کردستان,قروه,قروه - شهرك فرهنگیان -ابتدای شهرك - جنب مسجد الزهرا (س).,35226140-087 ( داخلی  ),http://lib.whc.ir
كتابخانه مدرسه علمیه خواهران الزهراء (س),مازندران,جویبار,جویبار - میدان معلم - خیابان گلاگر محله.,42531091-011 ( داخلی  ),http://lib.whc.ir
كتابخانه مدرسه علمیه خواهران الزهراء (س),آذربایجان غربی,شاهین دژ,شاهین دژ - بلوار غدیر خم - خیابان 9 دی - بالاتر از دانشگاه آزاد.,2-46334710-044 ( داخلی  ),http://lib.whc.ir
كتابخانه مدرسه علمیه خواهران الزهراء (س),اصفهان,خميني شهر,خمینی شهر - خیابان شریعتی جنوبی - كوچه پنچشنبه بازار.,1-33677910-031 ( داخلی  ),http://lib.whc.ir
كتابخانه مدرسه علمیه خواهران الزهراء (س),اصفهان,دهاقان,دهاقان - خیابان آزادگان - مجتمع مسكونی امام صادق (ع) روبروی دبستان غیر انتفاعی سماء.,32623040-031 ( داخلی  ),http://lib.whc.ir
كتابخانه مدرسه علمیه خواهران الزهراء (س),اصفهان,مباركه,مباركه - خیابان بسیج جنوبی - كوچه شهید عبدیان - مجتمع فرهنگی الزهرا (س).,35267701-031 ( داخلی  ),http://lib.whc.ir
كتابخانه مدرسه علمیه خواهران الزهراء (س),فارس,گراش,گراش - بلورا سرداران - انتهای خیابان شهید مطهری.,52446176-071 ( داخلی  ),http://lib.whc.ir
كتابخانه مدرسه علمیه خواهران الزهراء (س),تهران,شهر رى,شهر ری - خیابان قم - بالاتر از فرمانداری - جنب بهزیستی.,55909694-021 ( داخلی  ),http://lib.whc.ir
كتابخانه مدرسه علمیه خواهران الزهراء (س),تهران,تهران,تهران - كوی نصر - نبش كانال فاضل شرقی - پلاك 1/2 .,88252149-021 ( داخلی  ),http://lib.whc.ir
كتابخانه مدرسه علمیه خواهران الزهراء (س),تهران,واوان,واوان - فاز 2 - خیابان شهید رجایی - نبش كوچه 50 شرقی - پلاك 47.,56173232-021 ( داخلی  ),http://lib.whc.ir
كتابخانه مدرسه علمیه خواهران الزهراء (س),مرکزی,اراک,اراك - خیابان امام خمینی(ره)- پشت كانون بسیج جوانان- خیابان شورا- سه راه ابوذر- مقابل شركت- حوزه علمیه الزهرا(س),32247910-086 ( داخلی  ),http://
كتابخانه مدرسه علمیه خواهران الزهراء (س),همدان,همدان,همدان - خیابان شهدا- كوچه مرحوم آخوند - روبروی مدرسه علمیه آخوند - حوزه علمیه الزهرا(س).,32525668-081 ( داخلی  ),http://alzahra-hamedan.womenhc.com
كتابخانه مدرسه علمیه خواهران الزهراء (س),مازندران,ساری,ساری – خیابان جمهوری اسلامی - كوچه مقداد - جنب مسجد رانندگان - حوزه علمیه الزهرا(س).,33327486-011 ( داخلی  ),http://
كتابخانه مدرسه علمیه خواهران الزهراء (س ),زنجان,زنـجان,زنجان – سعدی وسط- جنب مسجد عباس قلی خان- حوزه علمیه الزهرا(س).,33360030-024 ( داخلی  ),http://
کتابخانه مدرسه علمیه خواهران الزهراء (س) ارومیه,آذربایجان غربی,اروميه,ارومیه- بلوار شهید دستغیب (خیابان مافی)- خیابان مدیریت- جنب دانشگاه الزهرا (س),04432233490 ( داخلی  ),http://
کتابخانه مدرسه علمیه خواهران الزهراء (س) آزادشهر,گلستان,آزاد شهر,آزادشهر- خیابان شهید رجایی- كوچه مكتب الزهرا (س)- بوستان3,01746726400 ( داخلی  ),http://
کتابخانه مدرسه علمیه خواهران الزهراء (س) استهبان,فارس,استهبان,استهبان- خیابان شهید فقیهی- كوچه شهید فقیهی13,07153233929 ( داخلی  ),http://lib.whc.ir
کتابخانه مدرسه علمیه خواهران الزهراء (س) بابل,مازندران,بابل,بابل- خیابان مدرس- خیابان هجدهم- كوچه شهید رسولی24 (ضرابپوری)- جنب بنیاد علمی مدیری,01132360076 ( داخلی  ),http://
کتابخانه مدرسه علمیه خواهران الزهراء (س) بندر عباس,هرمزگان,بندر عباس,بندرعباس- خیابان آیت اله غفاری- روبروی فرهنگسرای طوبی,07633339460 ( داخلی  ),http://
کتابخانه مدرسه علمیه خواهران الزهراء (س) پلدختر,لرستان,پلدختر,پلدختر- كوی بسیجیان- خیابان شریعتی- روبروی مسكن مهر,06632227042 ( داخلی  ),http://
کتابخانه مدرسه علمیه خواهران الزهراء (س) خوی,آذربایجان غربی,خوی,خوی- خیابان شریعتی- خیابان مصلی- جنب مصلی,04436220934 ( داخلی  ),http://
کتابخانه مدرسه علمیه خواهران الزهراء (س) داران,اصفهان,داران,داران (فریدن) - میدان شهرداری- خیابان شهید مطهری- بالاتر از فلكه پنج تن,03157225611 ( داخلی  ),http://
کتابخانه مدرسه علمیه خواهران الزهراء (س) دزفول,خوزستان,دزفول,دزفول- كوی آزادگان- ابتدای جاده مهرشهر- خیابان بهزیستی پردیس دانشگاهی.,06142425291 ( داخلی  ),http://
کتابخانه مدرسه علمیه خواهران الزهراء (س) شوش,خوزستان,شوش,شوش دانیال- خیابان امام خمینی(ره)- روبروی اداره آموزش و پرورش,06142824838 ( داخلی  ),http://
کتابخانه مدرسه علمیه خواهران الزهراء (س) شیراز,فارس,شیراز,شیراز- خیابان قاآنی شمالی- روبروی بانك تجارت,07137393443 ( داخلی  ),http://
کتابخانه مدرسه علمیه خواهران الزهراء (س) صحنه,کرمانشاه,صحنه,صحنه- شهرك امام خمینی (ره)- جنب مسجد- انتهای خیابان چهل متری- جنب مسجد امام حسین(ع)- مدرسه علمیه الزهرا(س),08383226898 ( داخلی  ),http://
کتابخانه مدرسه علمیه خواهران الزهراء (س) گرگان,گلستان,گرگان,گرگان- میدان شهید مفتح- بلوار شهید مفتح- خیابان حوزه,01714432470 ( داخلی  ),http://
کتابخانه مدرسه علمیه خواهران الزهراء (س) لردگان,چهار محال و بختیاری,لردگان,لردگان- فلكه معلم- بلوار شهداء- خیابان امام خمینی- كوچه25,03834443560 ( داخلی  ),http://
کتابخانه مدرسه علمیه خواهران الزهراء (س) کازرون,فارس,كازرون,کازرون- بلوارعلامه دوانی- ابتدای خیابان دوانی,07142221229 ( داخلی  ),http://
كتابخانه مدرسه علمیه خواهران الغدیر,تهران,تهران,تهران - خیابان هفده شهریور - خیابان عبدالرضا شیرازی(آبشار)- كوچه لواسانی - پلاك 8 .,33552110-021 ( داخلی  ),http://lib.whc.ir
كتابخانه مدرسه علمیه خواهران امام جعفر صادق (ع),سمنان,شاهرود,شاهرود - خیابان هفده شهریور -ساختمان پنج طبقه -مؤسسه امام صادق (ع).,32223637-023 ( داخلی  ),http://lib.whc.ir
كتابخانه مدرسه علمیه خواهران امام حسن مجتبی (ع),تهران,تهران,تهران - بزرگراه آیت الله سعیدی - جنب درب جنوبی امامزاده زید (ع).,66321186-021 ( داخلی  ),http://
كتابخانه مدرسه علمیه خواهران امام حسین (ع),مازندران,چالوس,چالوس - خیابان هفده شهریور - روبروی دانشگاه آزاد - جنب مسجد امام حسین (ع).,52228398-011 ( داخلی  ),http://lib.whc.ir
کتابخانه مدرسه علمیه خواهران امام خامنه ای کرمانشاه,کرمانشاه,كرمانشاه,کرمانشاه- ۲۲بهمن- سی متری دوم- کوی تعزیرات- کوچه23,08338395843 ( داخلی  ),http://
كتابخانه مدرسه علمیه خواهران امام خمینی (ره),کرمانشاه,كرمانشاه,كرمانشاه - میدان گلستان - جنب درمانگاه حاج دایی - بلوار گل سرخ - پلاك 51.,6-38383785-083 ( داخلی  ),http://lib.whc.ir
کتابخانه مدرسه علمیه خواهران امام صادق علیه السلام بوئین زهرا,قزوین,بوئین زهرا,بویین زهرا- میدان امام حسین (ع)- بلوار آیت الله طالقانی- جنب نانوایی,02834222359 ( داخلی  ),http://
كتابخانه مدرسه علمیه خواهران بانو امین,تهران,تهران,تهران - اول جاده لشكرك - مینی سیتی - شهرك شهید محلاتی - فاز یك - خیابان شهدای گمنام - سر ایثار - حسینیه امام خمینی (ره).,22452858-021 ( داخلی  ),http://lib.whc.ir
كتابخانه مدرسه علمیه خواهران بقیع,البرز,كرج,كرج - چهلو پنج متری گلشهر - خیابان ارغوان غربی - پلاك52.,33514903-026 ( داخلی  ),http://baghi-karaj.womenhc.com
کتابخانه مدرسه علمیه خواهران ثامن الحجج علیه السلام پارس آباد,اردبیل,پارس آباد,پارس آباد- خیابان امام خمینی (ره)- میدان سپاه- جنب دارالقرآن مهدی,04532724400 ( داخلی  ),http://
کتابخانه مدرسه علمیه خواهران جامعة النور اصفهان,اصفهان,اصفهان,اصفهان- بلوار كشاورز- گلزار هفتم- انتهای بن بست گلدسته,10107819511 ( داخلی  ),http://
كتابخانه مدرسه علمیه خواهران حجت (عج),تهران,تهران,تهران - انتهای خیابان جیهون - خیابان حسام الدین - جنب مسجد حضرت حجت(عج) - پلاك 262 .,55765533-55765522-021 ( داخلی  ),http://lib.whc.ir
كتابخانه مدرسه علمیه خواهران حضرت خدیجه (س),تهران,تهران,تهران - خیابان شریعتی - بالاتر از چهارراه قصر - خیابان محبی - پلاك 1.,88762877-021 ( داخلی  ),http://blog96.womenhc.com
کتابخانه مدرسه علمیه خواهران حضرت رقیه (س) رامهرمز,خوزستان,رامهرمز,رامهرمز- خیابان ولیعصر(عج)- جنب مسجد جامع,06143538230 ( داخلی  ),http://
كتابخانه مدرسه علمیه خواهران حضرت زهرا (س),کرمانشاه,كنگاور,كنگاور - میدان امام خمینی (ره) خیابان شهید مطهری - كوچه شهید چمران - پلاك 3.,48622581-083 ( داخلی  ),http://lib.whc.ir
كتابخانه مدرسه علمیه خواهران حضرت زهرا (س),اصفهان,خميني شهر,خمینی شهر - میدان 22 بهمن - بلوار توحید - بن بست شماره 13.,4-33632851-031 ( داخلی  ),http://lib.whc.ir
کتابخانه مدرسه علمیه خواهران حضرت زهرا (س) دورود,لرستان,دو رود,,( داخلی  ),http://
كتابخانه مدرسه علمیه خواهران حضرت زینب (س),هرمزگان,میناب,میناب - بلوار امام خمینی (ره) - كوچه 94 - سمت چپ - كوچه چهارم.,6-42228205-076 ( داخلی  ),http://lib.whc.ir
كتابخانه مدرسه علمیه خواهران حضرت زینب (س),کرمان,كرمان,كرمان - انتهای خیابان شهید رجایی - بعد از پل - حد فاصل شهرك ولایت و افضلی پور .,33412727-034 ( داخلی  ),http://lib.whc.ir
كتابخانه مدرسه علمیه خواهران حضرت زینب (س),یزد,يزد,یزد - میدان حضرت ابوالفضل - بلوار آزادگان - اولین بریدگی - کوچه شهید موحدین.,37230881-035 ( داخلی  ),http://
كتابخانه مدرسه علمیه خواهران حضرت زينب (س),اصفهان,آران و بيدگل,آران و بیدگل _ میدان ولی عصر(عج) _ بلوار شهید قاسمپور _ مدرسه علمیه حضرت زینب (س).,54724202-031 ( داخلی  ),http://h-zeynabqom.whc.ir
کتابخانه مدرسه علمیه خواهران حضرت زینب (س) امیدیه,خوزستان,امیدیه,امیدیه- پشت بازارمهاجرین- كوچه زینبیه-  روبروی خوابگاه دانشجویی.,061526520330 ( داخلی  ),http://
كتابخانه مدرسه علمیه خواهران حضرت عبدالعظیم (ع),تهران,شهر رى,تهران - میدان مدرس - انتهای خیابان هلال احمر - ضلع جنوبی حرم مطهر حضرت عبدالعظیم(ع).,51223325-021 ( داخلی  ),http://lib.whc.ir
كتابخانه مدرسه علمیه خواهران حضرت فاطمه (س),تهران,تهران,تهران - خیابان پیروزی - خیابان مقداد - فلكه دوم مقداد- پلاك 38 .,33051213-021 ( داخلی  ),http://lib.whc.ir
کتابخانه مدرسه علمیه خواهران حضرت فاطمه (س) رفسنجان,کرمان,رفسنجان,رفسنجان- خیابان شهید مطهری- کوچه 17- خیابان شهید وجدانی- روبروی آهن فروشی مقصودی,03434325561 ( داخلی  ),http://
کتابخانه مدرسه علمیه خواهران حضرت معصومه (س) جعفریه,قم,جعفریه,جعفریه- خیابان امام خمینی (ره)- جنب مسجد خاتم الانبیا,02536223444 ( داخلی  ),http://
کتابخانه مدرسه علمیه خواهران حضرت نرجس (س) ساری,مازندران,ساری,ساری- میدان خزر- كمر بندی شرقی- ضلع شرقی- سپاه كربلا,01133701690 ( داخلی  ),http://
کتابخانه مدرسه علمیه خواهران حضرت نرجس (س) نجف آباد (یزدانشهر),اصفهان,نجف آباد,یزدانشهر- بلوار آیت الله مطهری- نبش خیابان ششم شرقی- پلاك 2,03142450672 ( داخلی  ),http://
كتابخانه مدرسه علمیه خواهران حضرت ولی عصر (عج),تهران,تهران,تهران - خیابان جمهوری اسلامی - خیابان جمالزاده جنوبی - کوچه آیرم - پ 19 .,66928251-021 ( داخلی  ),http://Valiasr.whc.ir
کتابخانه مدرسه علمیه خواهران حضرت ولیعصر (ع) گرمی,اردبیل,گرمی,گرمی- محله هلال احمر- خیابان دكتر بهشتی- سه راه جهاد- جنب مسجد امام حسین (ع),04532641200 ( داخلی  ),http://
کتابخانه مدرسه علمیه خواهران خاتم الاوصیاء (ع) فاضل آباد,گلستان,فاضل آباد,فاضل آباد- خیابان ولیعصر(عج)- بالاتر از مسجد جامع- جنب سازمان تبلیغات,01734263660 ( داخلی  ),http://
كتابخانه مدرسه علمیه خواهران رضویه (ع),خراسان رضوی,مشهد,مشهد مقدس - چهارراه شهدا - خیابان شیرازی - کوی 19 - پلاک 19 - مدرسه علمیه رضویه.,05132222844 ( داخلی  ),http://mrazavieh.org
کتابخانه مدرسه علمیه خواهران ریحانة النبی (ص) تهران,تهران,تهران,تهران- ولنجك- بلوار دانشجو- میدان یاسمن- ابتدای یاسمن هفتم- پلاك1,02122400780 ( داخلی  ),http://
كتابخانه مدرسه علمیه خواهران زهرای اطهر (س),تهران,تهران,تهران - خیابان وحدت اسلامی - پایین تر از چهار راه وحدت اسلامی - روبروی اداره آگاهی - خیابان شهید پهلوان حسن - پلاك 59 .,55890777-55156655-021 ( داخلی  ),http://lib.whc.ir
کتابخانه مدرسه علمیه خواهران زهرائیه (س) نجف آباد,اصفهان,نجف آباد,نجف آباد- خیابان منتظری شمالی- كوچه شهید فقهی- پلاك 2,03142611995 ( داخلی  ),http://
كتابخانه مدرسه علمیه خواهران زینب كبری (س),تهران,تهران,تهران - پاسداران - خیابان گیلان - خیابان شهید مجید افشاری - جنب تالار ساقدوش - كوچه شهید جعفری - پلاك 7 .,7-22978296-021 ( داخلی  ),http://lib.whc.ir
کتابخانه مدرسه علمیه خواهران زینب کبری (س) رفسنجان,کرمان,رفسنجان,رفسنجان- خیابان شهدا 4 - کوچه مسجد جامع,03434257400 ( داخلی  ),http://
