name,province,city,address,phone_number,website,url
کتابخانه امام رضا(ع) بروجرد (آستان قدس رضوی ع),لرستان,بروجرد,بروجرد-خیابان 18متری-کوچه شهید اصغر پور,066،42629770 ( داخلی  ),http://,https://lib.ir/fa/library/782/کتابخانه-امام-رضا-ع-بروجرد-آستان-قدس-رضوی-ع/search/
كتابخانه آیت الله شیخ محمد تقی بروجردی (آستان قدس رضوی ع),لرستان,بروجرد,بروجرد - خيابان دكتر شريعتي - كوچه شهيد شايسته نيا - جنب درمانگاه امام خميني(ره) - كتابخانه آيت الله حاج شيخ محمد تقي بروجردي(ره).,۰۶۶-۰۶۶ آقایان:  ۴۲۶۱۱۶۳۰ -بانوان:   ۴۲۶۲۹۸۳۷  ( داخلی  ),http://aqlibrary.org,https://lib.ir/fa/library/163/كتابخانه-آیت-الله-شیخ-محمد-تقی-بروجردی-آستان-قدس-رضوی-ع/search/
كتابخانه عمومی شهید باهنر,لرستان,بروجرد,بروجرد - بلوار غربی - مهدیه جنوبی - پارك شهر.,42507657-066 ( داخلی  ),http://lorestanpl.ir,https://lib.ir/fa/library/248/كتابخانه-عمومی-شهید-باهنر/search/
كتابخانه عمومی علامه بحرالعلوم,لرستان,بروجرد,بروجرد - خیابان جعفری - پارك وحدت.,42445322-066 ( داخلی  ),http://borujerdpl-admin.persianblog.ir,https://lib.ir/fa/library/252/كتابخانه-عمومی-علامه-بحرالعلوم/search/
كتابخانه مدرسه علمیه خواهران محدثه (س),لرستان,بروجرد,بروجرد - خیابان شریعتی - كوچه ناصر خسرو (شهید محمد حسین عسگرپور) پلاك 14.,42446902-066 ( داخلی  ),http://lib.whc.ir,https://lib.ir/fa/library/486/كتابخانه-مدرسه-علمیه-خواهران-محدثه-س/search/
